title,score,id,url,comms_num,created,body,subreddit
"First-of-its-kind study quantifies the effects of political lobbying on likelihood of climate policy enactment, suggesting that lack of climate action may be due to political influences, with lobbying lowering the probability of enacting a bill, representing $60 billion in expected climate damages.",55404,bvwbag,https://www.news.ucsb.edu/2019/019485/climate-undermined-lobbying,1596,1559502679.0,,science
"Researchers found that people who have PTSD but do not medicate with cannabis are far more likely to suffer from severe depression and have suicidal thoughts than those who reported cannabis use over the past year. The study is based on 24,000 Canadians.",55400,ds4ix8,https://www.med.ubc.ca/news/cannabis-could-help-alleviate-depression-and-suicidality-among-people-with-ptsd/,1272,1573012345.0,,science
"Researchers find that one person likely drove Bitcoin from $150 to $1,000, in a new study published in the Journal of Monetary Economics. Unregulated cryptocurrency markets remain vulnerable to manipulation today.",55384,7qs5xz,https://techcrunch.com/2018/01/15/researchers-finds-that-one-person-likely-drove-bitcoin-from-150-to-1000/,3951,1516136638.0,,science
A study conducted by Hiroshima University researchers found that using Ultraviolet C light with a wavelength of 222 nanometers which is safer to use around humans effectively kills SARS-CoV-2 -- the first research in the world to prove its efficacy against the virus that causes COVID-19.,55300,iv1tue,https://www.hiroshima-u.ac.jp/en/news/60119,1504,1600444127.0,,science
"Europe has the capacity to produce more than 100 times the amount of energy it currently produces through onshore windfarms, new analysis has revealed. The new study reveals that Europe has the potential to supply enough energy for the whole world until 2050.",55198,csarwi,https://www.sussex.ac.uk/news/media-centre/press-releases/id/49312,2907,1566209956.0,,science
"Boys should be given HPV vaccine, says joint committee",54911,91hw9j,https://www.bmj.com/content/362/bmj.k3163,2773,1532471535.0,,science
"A lake of liquid water may have been spotted on Mars. If confirmed, this would mark a new, potentially habitable environment in the solar system.",54863,91s3jt,https://www.sciencenews.org/article/mars-may-have-lake-liquid-water-search-life?utm_source=reddit&utm_medium=social&utm_campaign=r_science,1840,1532556197.0,,science
"A new study has identified 21 existing drugs that stop the replication of SARS-CoV-2, the virus that causes COVID-19. “This study significantly expands the possible therapeutic options for COVID-19 patients, especially since many of the molecules already have clinical safety data in humans.""",54785,hyi0wo,https://www.sbpdiscovery.org/news/nature-study-identifies-21-existing-drugs-could-treat-covid-19,1211,1595838192.0,,science
"HPV vaccine eliminates skin cancer in 97-year-old, doctors report in a new paper in JAMA Dermatology. The woman had developed a severe case of squamous cell carcinoma, and chemotherapy and surgery were ruled out as treatments. Each tumor was injected with Gardasil, and all of them disappeared.",54730,8z1lg0,https://www.upi.com/Health_News/2018/07/13/HPV-vaccine-eliminates-skin-cancer-in-97-year-old-doctors-report/5551531492416/,599,1531688900.0,,science
Cancer cells engineered with CRISPR slay their own kin. Researchers engineered tumor cells in mice to secrete a protein that triggers a death switch in resident tumor cells they encounter.,54676,8yflh0,https://www.sciencenews.org/article/cancer-cells-engineered-crispr-slay-their-own-kin,1436,1531473187.0,,science
"The sounds that wake us up could be affecting how groggy and clumsy we are in the morning, new study shows. Harsh alarm tones can disrupt or confuse our brain activity when waking, while more melodic sounds can help us transition to a waking state in a more effective way and improve alertness level.",54659,ey3wu0,https://www.rmit.edu.au/news/media-releases-and-expert-comments/2020/feb/melodic-alarms,1906,1580746535.0,,science
"A single dose of psilocybin enhances creative thinking and empathy up to seven days after use, study finds (n=55), providing more evidence that psilocybin, the active ingredient in magic mushrooms, can improve creative thinking, empathy, and subjective well-being.",54534,aypqmq,https://www.psypost.org/2019/03/a-single-dose-of-psilocybin-enhances-creative-thinking-and-empathy-up-to-seven-days-after-use-study-finds-53283,1247,1552076987.0,,science
"Under Scott Pruitt, the Environmental Protection Agency (EPA) has dramatically shifted away from its stated mission to “protect human and environmental health.” Instead, the agency is clearly favoring the interests of the polluting industries that it is mandated to regulate, according to a study",54508,8ggtfb,https://ajph.aphapublications.org/doi/10.2105/AJPH.2018.304360,783,1525290910.0,,science
"The rate of teen pregnancy in the United States reached a historic low in 2015 due to higher contraceptive use, according to a study published last month by the U.S. Centers for Disease Control and Prevention",54437,6mfd6a,https://saludmovil.com/teen-pregnancies-plummet-due-higher-contraceptive-use/,2227,1499731293.0,,science
"After 40 Years of Searching, Scientists Identify The Key Flaw in Solar Panel Efficiency: A new study outlines a material defect in silicon used to produce solar cells that has previously gone undetected.",54426,bycdlx,https://www.sciencealert.com/scientists-identify-a-key-flaw-in-solar-panel-efficiency-after-40-years-of-searching,1177,1560055588.0,,science
Cannabis use after work (N=281) didn't negatively affect work performance in any way as rated by the user's supervisor.,54339,iehngy,https://journals.sagepub.com/doi/full/10.1177/1059601120917590,2502,1598128459.0,,science
"Babies can learn that hard work pays off. MIT researchers found that babies who watched an adult struggle at two different tasks before succeeding tried harder at their own difficult task, compared to babies who saw an adult succeed effortlessly.",54315,71q0q2,http://science.sciencemag.org/content/357/6357/1290,762,1506103471.0,,science
"Remains of high-THC cannabis discovered in 2,500-year-old funerary incense burners in the Pamir Mountains is the earliest known evidence of psychoactive marijuana use. It was likely used in mortuary ceremonies for communicating with the dead.",54297,bzugmi,https://www.inverse.com/article/56608-ancient-cannabis-pamir-mountain-tomb,1270,1560391246.0,,science
"Teen dating violence is down, but boys still report more violence than girls - When it comes to teen dating violence, boys are more likely to report being the victim of violence—being hit, slapped, or pushed—than girls, finds new research (n boys = 18,441 and n girls = 17,459).",54221,9bg654,https://news.ubc.ca/2018/08/29/teen-dating-violence-is-down-but-boys-still-report-more-violence-than-girls/,4676,1535628777.0,,science
"Lab Grown Meat: Scientists grew rabbit and cow muscles cells on edible gelatin scaffolds that mimic the texture and consistency of meat, demonstrating that realistic meat products may eventually be produced without the need to raise and slaughter animals.",54193,dkydj9,https://news.harvard.edu/gazette/story/2019/10/lab-grown-meat-gains-muscle-as-it-moves-from-petri-dish-to-dinner-plate/,2492,1571681600.0,,science
An estimated 8.5% of American adults shared at least one fake news article during the 2016 election. Age was a big factor. People over age 65 were seven times more likely to share a fake news article.,54181,aeannd,http://advances.sciencemag.org/content/5/1/eaau4586,2042,1547092754.0,,science
"Snakes and spiders evoke fear and disgust in many people. There has been debate about whether this aversion is innate or learnt. Scientists discovered that babies as young as six months old feel stressed when seeing these creatures, long before they could have learnt this reaction.",54142,77t9n0,http://www.cbs.mpg.de/Fear-of-spiders-and-snakes-is-deeply-embedded-in-us,2582,1508620204.0,,science
"The brains of people with excellent general knowledge are particularly efficiently wired, finds a new study by neuroscientists using a special form of MRI, which found that people with a very efficient fibre network had more general knowledge than those with less efficient structural networking.",54086,ckmyua,https://news.rub.de/english/press-releases/2019-07-31-neuroscience-what-brains-people-excellent-general-knowledge-look,1694,1564686736.0,,science
"Study of 95,000 children finds no link between MMR vaccines and autism, even within high-risk populations",53993,33czht,https://www.vocativ.com/culture/science/no-link-autism-and-vaccines-mmr/,3463,1429657294.0,,science
"The first complete dinosaur skeleton ever identified has finally been studied in detail and found its place in the dinosaur family tree, completing a project that began more than 150 years ago.",53966,ij6wxw,https://www.cam.ac.uk/stories/scelidosaurus,675,1598790901.0,,science
"A new study has shown a ""reverse gateway effect"" among street-involved young people, many of whom have been using cannabis to help transition off of more harmful drugs amid the ongoing opioid epidemic.",53921,i07t0a,https://journals.plos.org/plosone/article?id=10.1371/journal.pone.0236243#abstract0,873,1596082503.0,,science
A Harvard study finds that official death certificates in the U.S. failed to count more than half of the people killed by police in 2015—and the problem of undercounting is especially pronounced in lower-income counties and for deaths that are due to Tasers,53871,75iyb5,http://journals.plos.org/plosmedicine/article?id=10.1371/journal.pmed.1002399,1397,1507688000.0,,science
"The average person eats at least 50,000 particles of microplastic a year and breathes in a similar quantity, according to the first study to estimate human ingestion of plastic pollution. The scientists reported that drinking a lot of bottled water drastically increased the particles consumed.",53817,bx1sr1,https://www.theguardian.com/environment/2019/jun/05/people-eat-at-least-50000-plastic-particles-a-year-study-finds,2810,1559765225.0,,science
"It's safer to be a cop in the U.S. today than 50 years ago, finds a new study. Despite increases in violent crimes, the hazards of policing has dramatically declined since 1970 with a 75 percent drop in police officer line-of-duty deaths.",53673,bbzeke,https://www.fau.edu/newsdesk/articles/police-deaths-study.php,3859,1555015308.0,,science
"Tobacco farmers could make more money converting their fields to solar arrays, land use study finds.",53652,7vj7l3,https://www.mtu.edu/news/stories/2018/february/farm-sunshine-not-cancer-replacing-tobacco-fields-with-solar-arrays.html,1887,1517903729.0,,science
"A new study finds that levels of oxytocin, “the love hormone,"" are significantly lower in adults who were children when their parents divorced. This might explain why children of divorce struggle to form their own relationships in adulthood.",53640,iqoc5p,https://thriveworks.com/blog/levels-of-oxytocin-significantly-lower-in-adults-who-were-children-when-parents-divorced/,1519,1599850927.0,,science
"Being able to see green spaces from your home is associated with reduced cravings for alcohol, cigarettes and harmful foods. It's the first study to demonstrate that passive exposure to nearby greenspace is linked to both lower frequencies and strengths of craving.",53618,cc78kb,https://eurekalert.org/pub_releases/2019-07/uop-sgl071019.php,1142,1562941948.0,,science
Adults with positive SARS-CoV-2 test results were approximately twice as likely to have reported dining at a restaurant than were those with negative SARS-CoV-2 test results.,53594,ir136p,https://www.cdc.gov/mmwr/volumes/69/wr/mm6936a5.htm?s_cid=mm6936a5_w,2018,1599893297.0,,science
"Staring down seagulls can stop them stealing your chips, suggests a new study. Seagulls are sensitive to human gaze and change behaviour when being watched, suggesting that they have theory of mind, the capacity to infer the mental states of others, or associate being watched with being chased away.",53557,cnctmt,https://www.newscientist.com/article/2212592-staring-down-seagulls-can-stop-them-stealing-your-chips/,1370,1565246346.0,,science
Cost of preventing next pandemic 'equal to just 2% of Covid-19 economic damage',53557,hwl5k0,https://www.theguardian.com/world/2020/jul/23/preventing-next-pandemic-fraction-cost-covid-19-economic-fallout,1490,1595557927.0,,science
"Fake news can lead people to form false memories after they see fabricated news stories, especially if those stories align with their political beliefs, suggests a new study, which indicates how voters may be influenced in upcoming political contests like the 2020 US presidential race (n=3,140).",53322,ctvyu8,https://www.psychologicalscience.org/news/releases/fake-news-can-lead-to-false-memories.html,2204,1566501449.0,,science
"Brains of doers differ from those of procrastinators - Procrastinators have a larger amygdala and poorer connections between it and part of the cortex that blocks emotions, so they may be more anxious about the negative consequences of an action, and tend to hesitate and put off things.",53280,9aext4,http://news.rub.de/english/press-releases/2018-08-22-neuroscience-how-brains-doers-differ-those-procrastinators,1712,1535312417.0,,science
"No evidence playing violent video games leads to aggressive behaviour in teens, suggests new Oxford study (n=1,004, age 14-15) which found no evidence of increased aggression among teens who had spent longer playing violent games in the past month.",53253,aqiukk,https://www.independent.co.uk/news/health/violent-video-games-teenagers-mental-health-aggressive-antisocial-trump-a8776351.html,2072,1550173070.0,,science
"An indigenous farming technique that’s been around for thousands of years provides the basis for restoring rain forests stripped clear of trees by gold mining and other threats, using biochar, a cheap and effective way to support tree seedling survival during reforestation efforts in the Amazon.",53259,cy9mpe,https://news.wfu.edu/2019/08/29/biochar-a-better-start-to-rain-forest-restoration/,686,1567371539.0,,science
"Fatal car accidents in the United States spike by 6% during the workweek following the “spring forward” to daylight saving time, resulting in about 28 additional deaths each year, according to new University of Colorado Boulder research.",53094,ewdu7x,https://www.colorado.edu/today/2020/01/30/spring-forward-daylight-saving-time-brings-surge-deadly-crashes,1554,1580452984.0,,science
"A meteor impact 66 million years ago generated a tsunami-like wave in an inland sea that buried fish, mammals, insects and a dinosaur, the first victims of Earth’s last mass extinction event. The death scene from within an hour of the impact has been excavated at a fossil site in North Dakota.",53069,b8pcan,https://news.berkeley.edu/2019/03/29/66-million-year-old-deathbed-linked-to-dinosaur-killing-meteor/?T=AU,1646,1554270000.0,,science
"Scientists developed a new electrochemical path to transform carbon dioxide (CO2) into valuable products such as jet fuel or plastics, from carbon that is already in the atmosphere, rather than from fossil fuels, a unique system that achieves 100% carbon utilization with no carbon is wasted.",53041,bus3up,https://news.engineering.utoronto.ca/out-of-thin-air-new-electrochemical-process-shortens-the-path-to-capturing-and-recycling-co2/,1887,1559245227.0,,science
"First-generation university students (the first in their family to go to university) are at greater risk of experiencing imposter syndrome (the feeling that they don’t belong or have the skills/intelligence), suggests a new study (n=818) that looked at the competitive nature of STEM courses.",53032,em9t4e,https://digest.bps.org.uk/2020/01/09/first-generation-university-students-are-at-greater-risk-of-experiencing-imposter-syndrome/,1481,1578606192.0,,science
"Nearly three quarters of Americans don’t care about the religious affiliation of their hospital or healthcare network, but an equal number say they expect their healthcare preferences to take priority over the facility’s religious doctrine",53022,eh9l77,https://uk.reuters.com/article/us-health-hospitals-religion/patients-dont-care-about-provider-religious-ties-expect-all-needed-care-idUKKBN1YV1KP?rpc=401&,2418,1577673723.0,,science
"A major study tracking more than 300,000 commuters has revealed that cycling to work can cut the risk of dying early from illnesses such as heart disease and cancer by up to 24 per cent.",53021,gnddag,https://www.standard.co.uk/news/health/cycling-to-work-can-cut-risk-of-heart-disease-and-cancer-by-a-quarter-a4446131.html,2448,1590017188.0,,science
"New parents face up to six years of sleep deprivation, study says",53017,auyjso,https://www.theguardian.com/lifeandstyle/2019/feb/26/parenthood-sleep-deprivation-after-birth-mothers-hit-hardest-research?CMP=Share_iOSApp_Other,3616,1551210438.0,,science
"Democrat/Republican divide is worst it's ever been, and neither party can shoulder the blame, as it doesn't matter which party is in charge, finds a new study published in journal Social Networks.",52979,9kl8uj,https://msutoday.msu.edu/news/2018/democrat-republican-divide-is-worst-its-ever-been/,7043,1538463221.0,,science
"Study finds Intolerable bouts of extreme humidity and heat which could threaten human survival are on the rise across the world, suggesting that worst-case scenario warnings about the consequences of global heating are already occurring.",52969,gg41t0,https://advances.sciencemag.org/content/6/19/eaaw1838,3507,1589008733.0,,science
"Scientists have found that a worldwide Green New Deal would create nearly 30 million jobs. By 2050 the world will spend around $17 trillion per year on energy if we’re still relying on fossil fuels, and that number goes down to $6.8 trillion if we’re using renewable energy.",52956,einitm,https://www.inverse.com/article/62045-green-new-deal-jobs-economy-cost,3069,1577940406.0,,science
"Anti-inflammatory agents may reduce symptoms of major depression, suggests a new study (n=1,610), which adds to the mounting evidence that there is a connection between emotional functioning and inflammation, suggesting that inflammation may trigger depression, almost like an allergic reaction.",52948,dv87pj,https://www.psychologytoday.com/au/blog/expressive-trauma-integration/201911/anti-inflammatories-help-major-depression,2276,1573583417.0,,science
"One dose of “Magic Mushroom” drug reduces anxiety and depression in cancer patients, study says",52945,f7f3w2,https://www.cnn.com/2020/01/28/health/magic-mushrooms-psilocybin-cancer-patients-study-wellness/index.html,1819,1582337580.0,,science
"Dolphins learn unusual hunting behavior from their friends, using giant snail shells to trap fish and then shaking the shells to dislodge the prey into their mouths. This is the second known case of marine mammals using tools.",52922,hi1wdp,https://www.sciencemag.org/news/2020/06/dolphins-learn-unusual-hunting-behavior-their-friends?utm_campaign=news_daily_2020-06-26&et_rid=486754869&et_cid=3380909,772,1593473241.0,,science
"Medicaid could save $2.6 billion within a year if just 1% of its recipients quit smoking, according to new research by UCSF.",52775,bcpuxn,https://www.ucsf.edu/news/2019/04/413921/medicaid-could-save-26-billion-within-year-if-just-1-percent-recipients-quit,3178,1555186233.0,,science
"Young fish can be drawn to degraded coral reefs by loudspeakers playing the sounds of healthy reefs. Broadcasting healthy reef sound doubled the total number of fish arriving onto experimental patches of reef habitat, as well as increasing the number of species present by 50 per cent.",52657,e4eelj,http://www.bristol.ac.uk/biology/news/2019/coral-reef-restoration.html,644,1575219352.0,,science
"Dubstep music by Skrillex was found to protect against mosquito bites in a new study, with its mix of very high and very low frequencies. Such music, which appears to delay host attack, reduce blood feeding, and disrupt mating, may provide new avenues for music-based personal protective measures.",52658,b8a5ho,https://www.bbc.com/news/newsbeat-47770982,1433,1554185903.0,,science
"Twitter posts reveal rapid politicization of COVID-19 issue in U.S. Congress. Using AI, researchers could correctly classify the political party of the member who sent each COVID tweet 76 percent of the time, based only on the text of the tweet and the date it was sent.",52630,hf5wa2,https://news.osu.edu/twitter-posts-reveal-polarization-in-congress-on-covid-19/,1780,1593050480.0,,science
"Earth was stressed before dinosaur extinction - Fossilized seashells show signs of global warming, ocean acidification leading up to asteroid impact",52612,eandk6,https://news.northwestern.edu/stories/2019/12/earth-was-stressed-before-dinosaur-extinction/,2320,1576377291.0,,science
"New Ebola vaccine shows 100% effectiveness in a study of nearly 6,000 patients (p-value 0.0033)",52579,5jwidw,http://www.thelancet.com/journals/lancet/article/PIIS0140-6736(16)32621-6/fulltext,1273,1482518434.0,,science
"Alcohol causes significant harm to those other than the drinker, according to a new study (n=8,750), which found that each year, one in five U.S. adults (an estimated 53 million people) experience harm because of someone else's drinking. Society may need to combat the secondhand effects of drinking.",52574,c7r65v,https://www.eurekalert.org/pub_releases/2019-07/joso-acs062619.php,2251,1562007580.0,,science
"Thanks to a decline in homophobia, straight men are now better able to embrace ""bromances"" with other men -- which the study describes as being ""more emotionally intimate, physically demonstrative, and based upon unrivaled trust and cohesion compared to their other friendships"".",52572,69hghc,http://www.nbcnews.com/feature/nbc-out/i-love-you-man-new-study-explores-evolution-bromance-n755031,3119,1494048348.0,,science
"Newly discovered Amazon reef is six times bigger than previously thought, and it extends into oil drilling concessions. Researchers are now calling on the oil company to cancel its drilling project",52550,8efcfy,https://www.frontiersin.org/articles/10.3389/fmars.2018.00142/full,879,1524549572.0,,science
"In a new study involving people over 70 who have exercised regularly for years, scientists discovered that the participants' hearts, lungs, and muscles were in equivalent shape to those of people in their 40s.",52543,a4cpt6,https://www.generationactive.com/the-fountain-of-youth-exercise-can-make-a-30-year-difference-in-health/,1154,1544319694.0,,science
"People who regularly read with their toddlers are less likely to engage in harsh parenting and the children are less likely to be hyperactive or disruptive, a Rutgers-led study finds.",52537,bs72sj,https://news.rutgers.edu/reading-toddlers-reduces-harsh-parenting-enhances-child-behavior-rutgers-led-study-finds/20190417-0#.XOaegvZFz_o,1019,1558668040.0,,science
"People with more wealth tend to report being happier with life, according to a new psychological study of more than 4,000 millionaires. The study also found evidence that millionaires who earned their wealth were happier than those who inherited it.",52507,7ylx3m,http://www.psypost.org/2018/02/large-amount-wealth-linked-increased-happiness-especially-among-earned-50767,2946,1519067065.0,,science
"U.S. births fell to a 32-year low in 2018; CDC says birthrate is in record slump, the fourth consecutive year of birth decline. “People won't make plans to have babies unless they're optimistic about the future.”",52499,bs7l2m,https://www.npr.org/2019/05/15/723518379/u-s-births-fell-to-a-32-year-low-in-2018-cdc-says-birthrate-is-at-record-level,5304,1558670687.0,,science
"Scientists proposed a “Minimal Turing Test” where you get to use only one word to convince others you are human, and not a machine. The single word that people found most likely to distinguish a human from a machine based on a new study (total n = 3,000) was the word “poop”.",52356,9hu6e7,http://www.sciencemag.org/news/2018/09/want-convince-someone-you-re-human-one-word-could-do-trick,1480,1537593802.0,,science
"Police officers who were involved in complaints related to excessive force were more likely to work with officers with a history of such behaviors, suggesting that officers' peers may serve as social conduits through which misconduct is learned and transmitted (n = 8,642 Chicago police officers).",52270,cl2ug3,https://www.eurekalert.org/pub_releases/2019-08/nu-poe080119.php,1849,1564773977.0,,science
"Higher BMI is linked to decreased cerebral blood flow, which is associated with increased risk of Alzheimer's disease and mental illness. One of the largest studies linking obesity with brain dysfunction, scientists analyzed over 35,000 functional neuroimaging scans",52252,i4cwtu,https://www.iospress.nl/ios_news/body-weight-has-surprising-alarming-impact-on-brain-function/,1346,1596687314.0,,science
"Religious fundamentalists and dogmatic individuals are more likely to believe fake news, finds a new study, which suggests the inability to detect false information is related to a failure to be actively open-minded.",52225,9sbkwo,https://www.psypost.org/2018/10/study-religious-fundamentalists-and-dogmatic-individuals-are-more-likely-to-believe-fake-news-52426,2949,1540834309.0,,science
