title,score,id,url,comms_num,created,body,subreddit
"Scientists edge closer to creating a blood test that can detect multiple types of cancers, seeing success rates of around 70% in cancerous individuals",47421,7rg62r,https://www.npr.org/sections/health-shots/2018/01/18/578620342/scientists-edge-closer-to-a-blood-test-to-detect-cancers,727,1516368454.0,,science
"An estimated 1.7 billion people, 22% of the world population, have at least one underlying health condition that could increase their risk of severe COVID-19 if infected, according to a study that uses data from 188 countries",47379,ha2gsk,https://www.lshtm.ac.uk/newsevents/news/2020/estimates-suggest-one-five-people-worldwide-have-underlying-health-condition,1377,1592336979.0,,science
"Bonobo mothers pressure their children into having grandkids, just like humans. They do so overtly, sometimes fighting off rival males, bringing their sons into close range of fertile females, and using social rank to boost their sons' status.",47323,br14e0,https://www.inverse.com/article/55984-bonobo-mothers-matchmaker-fighters,805,1558414118.0,,science
"New study shows how LSD affects the ability of the thalamus to filter out unnecessary information, leading to an ""overload of the cortex"" we experience as ""tripping"".",47170,akrgaa,https://www.inverse.com/article/52797-lsd-trip-psychedelic-serotonin-receptors-thalamus,2255,1548735046.0,,science
"Older people can come to believe their own lies - New EEG research shows that within an hour of telling a falsehood, seniors may think it's the truth. Findings suggest that telling a falsehood scrambles older people’s memory so they have a harder time recalling what really happened.",47152,a1rlml,http://www.brandeis.edu/now/2018/november/lying-old-gutchess%20.html,1050,1543605717.0,,science
"People’s attachment to the wilderness is linked to the fulfillment of basic psychological needs, study finds",47142,jankg0,https://www.psypost.org/2020/10/peoples-attachment-to-the-wilderness-is-linked-to-the-fulfillment-of-basic-psychological-needs-study-finds-58254,955,1602655387.0,,science
Killer whales go through menopause to avoid competition with their daughters. This sheds light on why menopause exists at all.,47120,5nkhf2,https://www.researchgate.net/blog/post/why-do-killer-whales-go-through-menopause,1414,1484269213.0,,science
"A widely used and increasingly controversial insecticide called neonicotinoid has ""negligible"" benefits for farmers and commercially grown soybeans, suggests a new study. Scientists have discovered that it may be killing honey bees, monarch butterflies, certain birds and aquatic life.",47108,dd69j4,https://www.upi.com/Top_News/US/2019/10/04/Farmers-get-negligible-benefit-from-insecticide-that-may-kill-bees-researchers-say/2081569977453/,931,1570218514.0,,science
"Scientists have trained rats to drive tiny cars, suggesting that brains of rodents are more flexible than initially thought.",47103,dll0q6,https://www.newscientist.com/article/2220721-scientists-have-trained-rats-to-drive-tiny-cars-to-collect-food/,1462,1571793306.0,,science
A global team of scientists including researchers from Australia and the United States has found deforestation in the Brazilian Amazaon-Cerrado region is causing temperatures to rise in areas as far as 50km away from deforestation sites.,47065,cyobsz,http://www.news.uwa.edu.au/2019090211582/regional/forest-loss-brazil-contributing-rising-temperatures,884,1567456010.0,,science
"Most Cubans have no internet access, but get a rich variety of media and information in ""El Paquete"" (the weekly package), a 1 Tb collection of info distributed on USB keys. Selling EP is the largest occupation in Cuba, and challenges notions of how networks operate & what they mean to citizens",47050,8ex7p6,https://dl.acm.org/citation.cfm?doid=3173574.3174213,1834,1524720040.0,,science
"Of the 56 million abortions that take place worldwide every year, 45% are not considered safe by WHO standards. Most of the unsafe abortions take place in countries with restrictive abortion laws.",47047,7hdy95,http://www.mdmag.com/medical-news/advancements-and-challenges-in-global-abortion-safety,2106,1512379235.0,,science
"Cancer patients favor medical marijuana with higher THC, which relieves cancer symptoms and side effects, including chronic pain, weight loss, and nausea. Marijuana higher in CBD, which reduce seizures and inflammation, were more popular among non-cancer patients with epilepsy and MS (n=11,590).",46995,b5ofdy,https://www.eurekalert.org/pub_releases/2019-03/nlh-sst032219.php,1374,1553627847.0,,science
"Reddit's bans of r/coontown and r/fatpeoplehate worked--many accounts of frequent posters on those subs were abandoned, and those who stayed reduced their use of hate speech",46979,6zg6w6,http://comp.social.gatech.edu/papers/cscw18-chand-hate.pdf,6455,1505173383.0,,science
"The motivations underlying religious people’s sense of morality may be more in service of egoistic concerns, research suggests -- 'People may pursue moral identity for self-enhancing motivations, such as feeling that one is morally superior to others.'",46983,bqh6gc,https://www.inquisitr.com/5444066/religiosity-morality-religious-people/,2846,1558302780.0,,science
"For the first time, scientists show that psychedelic substances: psilocybin, ketamine and LSD, leads to an elevated level of consciousness, as measured by higher neural signal diversity exceeding those of normal waking consciousness, using spontaneous magnetoencephalographic (MEG) signals.",46922,669k31,https://www.nature.com/articles/srep46421,1713,1492629608.0,,science
"The ‘zombie gene’ that may protect elephants from cancer - With such enormous bodies, elephants should be particularly prone to tumors. But an ancient gene in their DNA, somehow resurrected, seems to shield them, by aggressively killing off cells whose DNA has been damaged, finds new research.",46880,97gysc,https://www.nytimes.com/2018/08/14/science/the-zombie-gene-that-may-protect-elephants-from-cancer.html,818,1534355377.0,,science
"Warning to adults: Children notice everything. Adults are good at paying attention only to what you tell them to – but children don’t ignore anything, a new study finds. That difference can help children do better than adults in some learning situations.",46866,cm9knd,https://news.osu.edu/warning-to-adults-children-notice-everything/,1172,1565031929.0,,science
"Most doctors think Obamacare has helped patients get better healthcare, even as a lengthy court battle threatens to strike down the law, finds a new study. About 60% of physicians in the US thought the Affordable Care Act gave more people access to medical treatment they wouldn't otherwise have had.",46862,d1hktw,https://www.upi.com/Health_News/2019/09/06/Most-doctors-think-Obamacare-opened-up-healthcare-access-study-says/7511567781988/,2466,1568008509.0,,science
"Fitting 925 pet cats with geolocating backpacks reveals a dark consequence to letting them out — Researchers found that, over the course of a month, cats kill between two and ten times more wildlife than native predators.",46823,fgxj75,https://www.inverse.com/science/should-you-let-your-cat-go-outside-gps-study-reveals-deadly-consequences,2821,1583963759.0,,science
"In California, parents could claim a personal belief exemption to vaccination, and the rate of kindergartners without up-to-date vaccinations was 9.84% in 2013. In 2016, due to measles outbreaks, California passed a bill banning all personal belief exemptions. The rate was halved to 4.87% in 2017.",46804,c91nrk,https://www.cnn.com/2019/07/02/health/california-vaccine-laws-study/index.html,1837,1562269686.0,,science
"A moderate level of piracy can have a positive impact on the bottom line for both manufacturer and retailer - and not at the expense of consumers - finds a new study. Because piracy can affect pricing power of manufacturer and retailer, it injects ""shadow"" competition into a monopolistic market.",46781,akmdhy,https://www.eurekalert.org/pub_releases/2019-01/iu-tht012519.php,2165,1548701726.0,,science
"A lost continent has been found under Europe. It's the size of Greenland and it broke off from North Africa, only to be buried under Southern Europe about 140 million years ago.",46771,da70pz,https://www.uu.nl/en/news/mountain-range-formation-and-plate-tectonics-in-the-mediterranean-region-integrally-studied-for-the,1581,1569649326.0,,science
Study of 550 college students who had used or were using Tinder finds about one in five participants admit to talking with a person on the dating app while in an exclusive romantic relationship,46761,7n2zqt,http://www.psypost.org/2017/12/how-often-are-college-students-using-the-dating-app-tinder-to-cheat-on-their-partners-infidelity-study-50493,1891,1514686026.0,,science
"Scientists found the 22 million-year-old fossils of a giant carnivore they call ""Simbakubwa"" sitting in a museum drawer in Kenya. The 3,000-pound predator, a hyaenodont, was many times larger than the modern lions it resembles, and among the largest mammalian predators ever to walk Earth's surface.",46736,bfoj4c,http://blogs.discovermagazine.com/deadthings/2019/04/18/simbakubwa/#.XLxlI5NKgmI,1547,1555880231.0,,science
"Doing just 10 min to 1 hour of leisure time physical activity such as dancing, walking, or gardening each week is associated with an 18 percent lower risk of death. All exercise, even the smallest, easiest amount, can have lasting benefits.",46685,b33wwc,https://www.inverse.com/article/54174-very-low-levels-of-exercise-can-help-improve-health,1039,1553063445.0,,science
"Scientists have genetically modified cassava, a staple crop in Africa, to contain more iron and zinc. The authors estimate that their GMO cassava could provide up to 50% of the dietary requirement for iron and up to 70% for zinc in children aged 1 to 6, many of whom are deficient in these nutrients.",46666,apkfqy,https://www.acsh.org/news/2019/02/11/gmo-cassava-can-provide-iron-zinc-malnourished-african-children-13805,1865,1549944857.0,,science
"'Dropout' rate for academic scientists has risen sharply in past 50 years, new study finds. Half of the people pursuing careers as scientists at higher education institutions will drop out of the field after five years, according to a new analysis.",46627,a530xs,https://news.iu.edu/stories/2018/12/iub/releases/10-academic-scientist-dropout-rate-rises-sharply-over-50-years.html,2987,1544527429.0,,science
"An uncomfortable disconnect between who we feel we are today, and the person that we believe we used to be, a state that psychologists recently labelled “derailment”, may be both a cause, and a consequence of, depression, suggests a new study (n=939).",46554,bw9a6y,https://digest.bps.org.uk/2019/06/03/researchers-have-investigated-derailment-feeling-disconnected-from-your-past-self-as-a-cause-and-consequence-of-depression/,989,1559587851.0,,science
"People find it hard to maintain eye contact when talking, possibly because the dual task of maintaining eye contact while also racking the brain for a word is just too demanding, so the brain pushes for breaking eye contact to focus exclusively on finding a word that will fulfill the obligation.",46537,5kqfi8,http://medicalxpress.com/news/2016-12-explanation-people-hard-eye-contact.html,1894,1482963583.0,,science
"Study: ""Autistic burnout is a syndrome conceptualized as resulting from chronic life stress and a mismatch of expectations and abilities without adequate supports. It is characterized by pervasive, long-term (typically 3+ months) exhaustion, loss of function, and reduced tolerance to stimulus""",46545,gyb96a,https://www.liebertpub.com/doi/10.1089/aut.2019.0079,1699,1591560797.0,,science
Wastewater created during fracking and disposed of by deep injection into underlying rock layers is the probably cause of a surge in earthquakes in southern Kansas over the last 5 years.,46536,7ywmqr,https://www.eurekalert.org/pub_releases/2018-02/ssoa-efw021218.php,1913,1519168766.0,,science
Scientists have discovered a new technique can turn plastic waste into energy-dense fuel. To achieve this they have converting more than 90 percent of polyolefin waste — the polymer behind widely used plastic polyethylene — into high-quality gasoline or diesel-like fuel,46529,arjh4q,https://www.digitaltrends.com/cool-tech/purdue-university-platic-into-fuel/,1229,1550428744.0,,science
"The cheapest ""green diet"" costs $2.84 per day, according to a study in The Lancet, but that isn’t affordable for 1.68 billion people, more than a fifth of the global population",46504,dti2al,https://www.inverse.com/article/60766-sustainable-diet-not-affordable,2534,1573260366.0,,science
The prevalence of dementia in countries where more than one language is spoken is 50% lower than in those regions where the population uses only one language to communicate. Active bilingualism is an important predictor of delay in the onset of symptoms of mild cognitive impairment.,46454,j3rpem,https://www.uoc.edu/portal/en/news/actualitat/2020/360-bilingualism-alzheimer.html,632,1601660969.0,,science
"Black women with natural hairstyles, like curly afros, braids, or twists, are often seen as less professional than black women with straightened hair, new research suggests. Findings show that societal bias against natural black hairstyles exists in the workplace and perpetuates race discrimination.",46411,iddt59,https://www.fuqua.duke.edu/duke-fuqua-insights/ashleigh-rosette-research-suggests-bias-against-natural-hair-limits-job,4701,1597970540.0,,science
"Horses identify photographs of their current keepers, and even of former keepers whom they had not seen in six months, at a rate much better than chance. Horses correctly identified their current keeper and ignored the stranger’s face about 75 percent of the time",46404,ggway2,https://www.scientificamerican.com/podcast/episode/horses-recognize-pics-of-their-keepers/,682,1589120740.0,,science
"More than 60% of people surveyed in a new study supported marijuana legalization because they agreed with arguments saying it would increase tax revenues, create a profitable new industry, reduce prison crowding and lower the cost of law enforcement, finds Cornell University researchers.",46365,5yguh3,http://mediarelations.cornell.edu/2017/03/08/pro-pot-arguments-fly-higher-with-likely-voters/,1698,1489113625.0,,science
A new study detected an immediate and significant reversal in SARS-CoV-2 epidemic suppression after relaxation of social distancing measures across the US. Premature relaxation of social distancing measures undermined the country’s ability to control the disease burden associated with COVID-19.,46310,j62ree,https://academic.oup.com/cid/advance-article/doi/10.1093/cid/ciaa1502/5917573,2376,1602009384.0,,science
"Food neophobia, an eating behaviour trait in which a person refuses to taste and eat new food they are not familiar with, may lead to poorer dietary quality and increase the risk of developing lifestyle diseases, finds a new study (n = 4,091, ages 18-83).",46304,c2flkp,https://thl.fi/en/web/thlfi-en/-/food-neophobia-may-lead-to-poorer-dietary-quality-and-increase-the-risk-of-lifestyle-diseases,3250,1560970560.0,,science
"Researchers developed a bandage that changes color when it contacts the acidic microenvironment of a bacterial infection and releases an antibiotic. If drug-resistant bacteria are present, the researchers can shine light to cause the bandage to release reactive oxygen species that kill the bacteria.",46279,evmt14,https://www.eurekalert.org/pub_releases/2020-01/acs-cbs012420.php#.XjGGxAojcII.reddit,514,1580332955.0,,science
"Doctors in the U.S. experience symptoms of burnout at almost twice the rate of other workers, due to long hours, fear of being sued, and having to deal with growing bureaucracy. The economic impacts of burnout are also significant, costing the U.S. $4.6 billion every year, according to a new study.",46262,btzyu8,http://time.com/5595056/physician-burnout-cost/,2460,1559078550.0,,science
"A long-dormant Russian Volcano, Bulshaya Undina, is believed by some scientists to be erupting again; its last period of eruption was 10,000 years ago, still during the Paleolithic Age.",46211,dm7vv3,https://www.sciencenews.org/article/dormant-russia-volcano-bolshaya-udina-waking-complicated,987,1571902489.0,,science
"The Arctic Is Shifting to a New Climate Because of Global Warming- Open water and rain, rather than ice and snow, are becoming typical of the region, a new study has found.",46160,it8ceu,https://www.nytimes.com/2020/09/14/climate/arctic-changing-climate.html?referringSource=articleShare&utm_campaign=Hot%20News&utm_medium=email&_hsmi=95274590&_hsenc=p2ANqtz-8dGkCtosN9fjT4w2FhMuAhgyI7JppOCQ6qRbvyddfPlNAnWAKvo8TOKlWpOIk2sF8FGT3b9XQ2cEglHK01fHSZu9KeGA&utm_content=95274590&utm_source=hs_email,1705,1600203863.0,,science
"Hope is a key factor in recovering from anxiety disorders, suggests a new study, which found that cognitive behavior therapy (CBT) can result in clear increases in hope, associated with changes in anxiety symptoms, in social anxiety disorder, panic disorder, generalized anxiety disorder and OCD.",46131,die1px,http://www.uh.edu/news-events/stories/2019/october-2019/101419-hope-anxiety-gallagher.php,1464,1571200712.0,,science
"By 7 years old, kids get that hypocrisy is wrong, suggests new research, which discovered that children who were at least 7 years old began to predict future behavior based on a person’s statement about morals (n=435, age 4-9).",46068,dx5avg,https://www.futurity.org/hypocrisy-kids-morals-2213662/,734,1573929283.0,,science
"Drug which makes human blood 'lethal' to mosquitoes can reduce malaria spread, finds a new cluster-randomised trial, the 'first of its kind' to show ivermectin drug can help control malaria across whole communities without causing harmful side effects (n=2,712, including 590 aged<5).",46052,b24k9e,https://www.independent.co.uk/news/health/malaria-mosquito-drug-human-blood-poison-stop-ivermectin-trial-colorado-lancet-a8821831.html,1194,1552853503.0,,science
Historian unearths solid evidence for the Armenian Genocide. The Ottoman government's systematic extermination of 1.5 million Armenians was carried out during and after WWI. Turkey continues to contest the figure and denies that the killings were systematically orchestrated and constitute a genocide,46045,chbigq,https://www.eurekalert.org/pub_releases/2019-07/tfg-hus071119.php,2009,1564019544.0,,science
"Psilocybin combined with psychological support might correct pessimism biases in depression - The psychedelic drug psilocybin could help alleviate depression by causing people to have a less pessimistic outlook on life, according to new preliminary research.",46039,ai2lvw,https://www.psypost.org/2019/01/psilocybin-combined-with-psychological-support-might-correct-pessimism-biases-in-depression-52982,1259,1548048753.0,,science
"Cannabis may have had high origins, with a new analysis of ancient pollen suggesting it evolved some 3 kilometres above sea level on the Tibetan Plateau. Incidentally, this site is only a few hundred kilometres from a cave that was once home to our ancient Denisovan cousins.",45958,bq2tlb,https://www.newscientist.com/article/2203647-cannabis-plant-evolved-super-high-on-the-tibetan-plateau/,1640,1558206170.0,,science
"Low-dose THC can relieve stress; more does just the opposite - researchers report that low levels of THC, the main psychoactive compound in marijuana, does reduce stress, but slightly higher doses, enough to produce a mild “high”, actually increased anxiety.",45944,6f0lyc,https://news.uic.edu/low-dose-thc-can-relieve-stress-more-does-just-the-opposite,2598,1496515811.0,,science
"A new study has found a parasite living inside fish eyeball controls its behaviour. When the parasite is young, it helps its host stay safe from predators. But once the parasite matures, it does everything it can to get that fish eaten by a bird and so continue its life cycle.",45929,698yjp,https://www.newscientist.com/article/2129880-parasite-living-inside-fish-eyeball-controls-its-behaviour/?utm_campaign=RSS%7CNSNS&utm_source=NSNS&utm_medium=RSS&utm_content=life&campaign_id=RSS%7CNSNS-life,1879,1493947724.0,,science
"WHO, CDC data shows measles cases up 30 percent globally, with the disease killing more than 140,000 people worldwide in 2018, despite the availability of a vaccine. “That anyone should die from measles... is a collective failure which must be addressed”.",45925,e6wes6,https://www.upi.com/Health_News/2019/12/05/WHO-CDC-data-shows-measles-cases-up-30-percent-globally/1511575562512/,1835,1575652443.0,,science
"Researchers show that socioeconomic attributes such as income, race and voting patterns can be inferred from cars detected in Google Street View. For example, if the number of pickup trucks is greater than the number of sedans, the neighborhood is overwhelmingly likely to vote Republican.",45914,7nu3co,http://pnas.org/content/114/50/13108.full,2341,1515008024.0,,science
"Post-COVID syndrome severely damages children’s hearts; ‘immense inflammation’ causing cardiac blood vessel. Multisystem inflammatory syndrome in children (MIS-C), believed to be linked to COVID-19, damages the heart to such an extent that some children will need lifelong monitoring & interventions.",45900,ins5oc,https://news.uthscsa.edu/post-covid-syndrome-severely-damages-childrens-hearts-immense-inflammation-causing-cardiac-blood-vessel-dilation/,1535,1599448955.0,,science
"Plant remains point to evidence that the cave’s occupants used grass bedding about 200,000 years ago. Researchers speculate that the cave’s occupants laid their bedding on ash to repel insects. If the dates hold up, this would be the earliest evidence of humans using camp bedding.",45890,i9llsk,https://www.sciencemag.org/news/2020/08/world-s-oldest-camp-bedding-found-south-african-cave,849,1597439179.0,,science
"Royal jelly, a substance secreted by bees and fed to larvae, has traditionally been used to heal wounds. Now, scientists have discovered the molecule in royal jelly that is responsible for wound-healing.",45875,6te4e4,http://www.acsh.org/news/2017/08/12/molecule-bees-royal-jelly-promotes-wound-healing-11683,1227,1502643165.0,,science
"One injection of an antibody treatment let people with severe peanut allergy eat a nut’s worth of peanut protein two weeks later, a small pilot study shows. The study provides early evidence that the antibody is a safe, effective, and rapid food allergy treatment.",45863,dwd9og,http://med.stanford.edu/news/all-news/2019/11/antibody-injection-stops-peanut-allergy-for-2-to-6-weeks--study-.html,799,1573783453.0,,science
"Delaying school start time can result in sustained benefits on sleep duration, daytime alertness, and mental well-being even within a culture where trading sleep for academic success is widespread, based on a study of 375 students in grades 7–10 from an all-girls’ secondary school in Singapore.",45859,8bgafx,https://academic.oup.com/sleep/advance-article/doi/10.1093/sleep/zsy052/4960018,1833,1523474510.0,,science
New psychology research finds extreme protest actions reduce popular support for social movements,45805,gv600a,https://www.psypost.org/2020/05/new-psychology-research-finds-extreme-protest-actions-reduce-popular-support-for-social-movements-56906?fbclid=IwAR0dXw0ft4J_iu-o33nxd0jzC5Dq6i6ARBhSQFHkDAFEqDa8yJVVUd8UKFw,4838,1591127910.0,,science
"Suicidal behavior has nearly doubled among children aged 5 to 18, with suicidal thoughts and attempts leading to more than 1.1 million ER visits in 2015 -- up from about 580,000 in 2007, according to an analysis of U.S. data.",45791,bb0gr6,https://jamanetwork.com/journals/jamapediatrics/fullarticle/2730063?guestAccessKey=eb570f5d-0295-4a92-9f83-6f647c555b51&utm_source=For_The_Media&utm_medium=referral&utm_campaign=ftm_links&utm_content=tfl&utm_term=04089%20.,3950,1554793387.0,,science
"When political beliefs are challenged, a person’s brain becomes active in areas that govern personal identity and emotional responses to threats, USC researchers find",45759,5k3hb0,http://news.usc.edu/114481/which-brain-networks-respond-when-someone-sticks-to-a-belief/,1987,1482621999.0,,science
Scientists have directly shown that bacteria can “change shape” in the human body to avoid being targeted by antibiotics – a process that requires no genetic changes for the bacteria to continue growing.,45747,db9q2g,https://theconversation.com/antibiotic-resistance-researchers-have-directly-proven-that-bacteria-can-change-shape-inside-humans-to-avoid-antibiotics-124296,556,1569869232.0,,science
"Scientists first in world to sequence genes for spider glue - the first-ever complete sequences of two genes that allow spiders to produce glue, a sticky, modified version of spider silk that keeps a spider’s prey stuck in its web, bringing us closer to the next big advance in biomaterials.",45735,byw0fa,https://news.umbc.edu/umbcs-sarah-stellwagen-first-in-world-to-sequence-genes-for-spider-glue/,548,1560189832.0,,science
Older adults with existing depression show resilience during the pandemic: A multi-site study finds that seniors are more concerned with being infected with COVID-19 than the effects of social isolation,45675,icz6ec,https://www.uclahealth.org/older-adults-with-existing-depression-show-resilience-during-the-pandemic,1194,1597909022.0,,science
Earth Lost a 'Staggering' 28 Trillion Tonnes of Ice in Just 23 Years,45663,ifh28n,https://www.sciencealert.com/earth-lost-a-staggering-28-trillin-tonnes-of-ice-in-23-years-scientist-find,1521,1598266805.0,,science
