title,score,id,url,comms_num,created,body,subreddit
Physicist Stephen Hawking dies aged 76,199294,84aiy6,https://www.reddit.com/r/science/comments/84aiy6/physicist_stephen_hawking_dies_aged_76/,3891,1521029174.0,"We regret to hear that [Stephen Hawking died tonight at the age of 76]( http://www.bbc.com/news/uk-43396008)

We are creating a megathread for discussion of this topic here. The typical /r/science comment rules will not apply and we will allow mature, open discussion. This post may be updated as we are able.

A few relevant links: 

[Stephen Hawking's AMA on /r/science](https://www.reddit.com/r/science/comments/3nyn5i/science_ama_series_stephen_hawking_ama_answers/)

[BBC's Obituary for Stephen Hawking](http://www.bbc.com/news/science-environment-15555565)

If you would like to make a donation in his memory, the Stephen Hawking Foundation has [the Dignity Campaign](http://www.stephenhawkingfoundation.org/dignity-campaign/) to help buy adapted wheelchair equipment for people suffering from motor neuron diseases.  You could also consider donating to [the ALS Association](http://www.alsa.org/donate/) to support research into finding a cure for ALS and to provide support to ALS patients.",science
The first picture of a black hole opens a new era of astrophysics. The supermassive beast lies in a galaxy called M87 more than 50 million light-years away,155295,bblu6v,https://www.sciencenews.org/article/black-hole-first-picture-event-horizon-telescope?utm_source=reddit&utm_medium=social&utm_campaign=r_science,5587,1554930697.0,,science
"Since legalizing cannabis in 2012, crime clearance rates are increasing faster in Washington and Colorado than the rest of country, suggesting that legalization may free police to focus on more serious crimes.",124696,90adse,https://www.google.com/amp/s/www.washingtonpost.com/amphtml/business/2018/07/18/does-legal-weed-make-police-more-effective/,4803,1532067712.0,,science
Raising the taxes of graduate students by as much as 300% will be a disaster for the USA,124375,7e1jo1,https://www.reddit.com/r/science/comments/7e1jo1/raising_the_taxes_of_graduate_students_by_as_much/,11028,1511137447.0,"Science and technology development has been the story of the past 100 years.  The discoveries and innovations are progressing at a dazzling rate, much of this lead by researchers at universities in the USA.  At these universities, a substantial amount of the work is done by graduate students, who work long hours (80 hours weeks aren't unusual) for little pay.  These graduate students go on to work in good paying jobs, where their innovations make more jobs for others.  


Start-ups develop to bring new innovations based on the skills graduate students learn (Google was the project of a couple of Stanford grad students, even Reddit benefited from the skills of a physics grad student/PhD, /u/keysersosa, the current CTO.)  Grad school has been for decades a path to prosperity for  those who come from humble beginnings but are willing to work hard, and make sacrifices, a system that has greatly benefited all of us.


This is why we scientists are shocked and appalled by the recently passed tax bill in congress which will result in the tax bills of already poor grad students [going up by as much as 300%](http://fortune.com/2017/11/08/graduate-students-say-gop-tax-plan-could-increase-their-taxes-by-nearly-300/), which would see their take-home pay drop by 25%. As a former grad student myself, I can tell you that I would not have been able to continue if my pay had be reduced by $7,000, and many students would make the same conclusion.  Instead, some will not go into science or they will leave the USA to be a grad student in Europe or Asia, most of these students will never return to the USA. 


This is why every major science organization has [voiced opposition to the current tax plan](https://www.aaas.org/sites/default/files/AAAS%20Multisociety%20Letter%20on%20Tax%20Reform.pdf?D1fnCM0H.C.qegz_Yo2wJwPV7IWBzuGy), make no mistake, this plan will [undermine research and eventually the economy of the USA](https://www.nature.com/articles/d41586-017-05925-6).

In comic form from [PhD Comics](http://phdcomics.com/comics/archive.php?comicid=1985).


What can we do to stop it?  Call your representatives in congress and let them know.  It hasn't passed yet, but it's about to.  If we don't raise voices now, we will all regret it.

Edit: There is an official White House petition you can sign to express your opposition: https://petitions.whitehouse.gov/petition/opposition-taxation-graduate-student-tuition-waivers-and-remissions

Aslo: https://medium.com/@avandervort/an-open-letter-to-the-senate-concerning-h-r-1-and-the-graduate-student-tax-provision-5ff7ace9262d

 ",science
No evidence to support link between violent video games and behaviour - Researchers at the University of York have found no evidence to support the theory that video games make players more violent.,114564,7s6a9z,https://www.york.ac.uk/news-and-events/news/2018/research/no-evidence-to-link-violence-and-video-games/,3814,1516662119.0,,science
New study finds that most redditors don’t actually read the articles they vote on.,110988,7gn1ne,https://motherboard.vice.com/en_us/article/vbz49j/new-study-finds-that-most-redditors-dont-actually-read-the-articles-they-vote-on,4573,1512084188.0,,science
"Scientists believe that the function of zebras' stripes are to deter insects, so a team of researchers painted black and white stripes on cows. They found that it reduced the number of biting flies landing on the cows by more than 50%.",109325,dei73a,https://www.realclearscience.com/quick_and_clear_science/2019/10/07/painting_zebra_stripes_on_cows_wards_off_biting_flies.html,2052,1570476899.0,,science
"Having kids makes you happier, but only when they move out, according to a new study, which suggests that parents are happier than non-parents later in life, when their children move out and become sources of social enjoyment rather than stress (n=55,000).",104589,cs072c,https://www.newscientist.com/article/2213655-having-kids-makes-you-happier-but-only-when-they-move-out/,4054,1566157289.0,,science
"Woman with ‘mutant’ gene who feels no pain and heals without scarring discovered by scientists. She reported numerous burns and cuts without pain, often smelling her burning flesh before noticing any injury, as published in the British Journal of Anaesthesia, and could open door to new treatments.",101698,b6hy7e,https://www.independent.co.uk/news/health/healing-powers-no-pain-mutant-gene-scotland-a8842836.html,3252,1553803491.0,,science
"The first human trial of a COVID-19 vaccine finds that it is safe, well-tolerated, and induces a rapid immune response: “These results represent an important milestone.”",97521,gp2hdt,https://www.thelancet.com/journals/lancet/article/PIIS0140-6736(20)31208-3/fulltext,2432,1590257381.0,,science
"Scientists replaced 40 percent of cement with rice husk cinder, limestone crushing waste, and silica sand, giving concrete a rubber-like quality, six to nine times more crack-resistant than regular concrete. It self-seals, replaces cement with plentiful waste products, and should be cheaper to use.",97230,dqysmm,https://newatlas.com/materials/rubbery-crack-resistant-cement/,1643,1572806818.0,,science
"A new study in The Lancet by a team of Yale epidemiologists finds that Medicare for All would save more than 68,000 lives annually as well as $450 billion in cost",94803,f4998k,https://www.sciencedirect.com/science/article/pii/S0140673619330193,5522,1581801306.0,,science
"MMR vaccine does not cause autism, another study confirms",94094,axd4l4,https://www.cnn.com/2019/03/04/health/mmr-vaccine-autism-study/index.html,2572,1551766223.0,,science
"Tree stumps that should be dead can be kept alive by nearby trees, discovers new study, which found a tree stump that should have died is being kept alive by neighbouring trees through an interconnected root system, which may change our view from trees as individuals to forests as ‘superorganisms’.",92349,chwg8s,https://www.newscientist.com/article/2211209-tree-stumps-that-should-be-dead-can-be-kept-alive-by-nearby-trees/,1929,1564133153.0,,science
"Healthy obesity doesn’t exist; obesity is not a benign condition - new study, published in the Journal of the American College of Cardiology, show.",91801,795tpr,https://www.nytimes.com/2017/10/26/well/eat/fat-but-fit-the-controversy-continues.html,6171,1509164859.0,,science
"Research finds that crows know what they know and can ponder the content of their own minds, a manifestation of higher intelligence and analytical thought long believed the sole province of humans and a few other higher mammals.",91360,izbj3r,https://www.statnews.com/2020/09/24/crows-possess-higher-intelligence-long-thought-primarily-human/,2921,1601030870.0,,science
"Venom from honeybees has been found to rapidly kill aggressive and hard-to-treat breast cancer cells, finds new Australian research. The study also found when the venom's main component was combined with existing chemotherapy drugs, it was extremely efficient at reducing tumour growth in mice.",91289,ikivxq,https://www.abc.net.au/news/2020-09-01/new-aus-research-finds-honey-bee-venom-kills-breast-cancer-cells/12618064,1520,1598990172.0,,science
"Marijuana use among college students has been trending upward for years, but in states that have legalized recreational marijuana, use has jumped even higher. After legalization, however, students showed a greater drop in binge drinking than their peers in states where marijuana is not legal.",90864,eoomwz,https://today.oregonstate.edu/news/college-students-use-more-marijuana-states-where-it%E2%80%99s-legal-they-binge-drink-less,3447,1579052989.0,,science
Bird deaths down 70 percent after painting wind turbine blades,90391,igmtvw,https://arstechnica.com/science/2020/08/black-paint-on-wind-turbines-helps-prevent-bird-massacres/,2191,1598424017.0,,science
"In Seattle, Washington, delaying the start time of two high schools by nearly an hour lengthened students' daily sleep by more than half an hour, and was associated with reduced sleepiness and increased academic performance.",89347,a5li71,https://www.eurekalert.org/pub_releases/2018-12/aaft-dhs121018.php,2845,1544672315.0,,science
"Self-driving cars will ""cruise"" to avoid paying to park, suggests a new study based on game theory, which found that even when you factor in electricity, depreciation, wear and tear, and maintenance, cruising costs about 50 cents an hour, which is still cheaper than parking even in a small town.",89213,am2056,https://news.ucsc.edu/2019/01/millardball-vehicles.html,6366,1549056577.0,,science
"The United States, on a per capita basis, spends much more on health care than other developed countries; the chief reason is not greater health care utilization, but higher prices, according to a new study from Johns Hopkins.",89156,admli1,https://www.jhsph.edu/news/news-releases/2018/us-health-care-spending-highest-among-developed-countries.html,5329,1546925929.0,,science
"U.S. adults look to scientific organizations like the Centers for Disease Control and Prevention, rather than their president, to lead the country’s response to the coronavirus pandemic",89023,gl1nvf,https://www.psypost.org/2020/05/us-population-trusts-scientific-leaders-over-president-trump-when-it-comes-to-covid-19-study-suggests-56782,3313,1589689374.0,,science
"Paleontologists have dug up a 130,000-year-old mastodon skeleton that looks like it was butchered by humans. But they found it in America, where people were not supposed to have arrived for another 100,000 years. Findings could upend our understanding of human history.",87277,67qs7r,http://www.nbcnews.com/science/science-news/mastodon-bone-findings-could-upend-our-understanding-human-history-n751406,3572,1493266965.0,,science
"Industrial methane emissions are 100 times higher than reported, and have been vastly underestimated, finds a new study using a Google Street View car equipped with a high-precision methane sensor. They also were substantially higher than the EPA estimate for all industrial processes in the US.",85488,bxmxri,http://news.cornell.edu/stories/2019/06/industrial-methane-emissions-are-100-times-higher-reported-researchers-say,2934,1559888913.0,,science
"Babies, even when hungry, are willing to give a tasty snack to a stranger in need, new study shows. The findings demonstrate that altruism (the act of giving away something desirable, even at a cost to oneself) begins in infancy and suggest that early social experiences can shape altruism.",84787,eyp2nd,https://edition.cnn.com/2020/02/04/health/altruistic-infants-wellness/index.html,1151,1580846694.0,,science
Human 'microevolution' sees more people born without wisdom teeth and an extra artery,84055,j7w01e,https://news.sky.com/story/human-microevolution-sees-more-people-born-without-wisdom-teeth-and-an-extra-artery-12099689,4531,1602265176.0,,science
"Children as young as age 4 express dislike of and are willing to punish those who freeload off the work of other group members, a new study has found. But kids also make a clear distinction between those who freeload intentionally and those who have good reasons why they can’t contribute.",84005,91b8gd,https://news.yale.edu/2018/07/23/even-4-year-olds-dislike-freeloaders,1821,1532410548.0,,science
Seven Earth-sized planets found orbiting an ultracool dwarf star are strong candidates in the search for life outside our solar system.,83684,5vk7pv,https://www.researchgate.net/blog/post/system-of-seven-earth-like-planets-could-support-life,2866,1487815209.0,,science
"The Netflix show ""13 Reasons Why"" was associated with a 28.9% increase in suicide rates among U.S. youth ages 10-17 in the month (April 2017) following the shows release, after accounting for ongoing trends in suicide rates, according to a study.",83630,bisiq5,https://www.eurekalert.org/pub_releases/2019-04/niom-ro042919.php,4711,1556589368.0,,science
"Every dollar spent on high-quality, early-childhood programs for disadvantaged children returned $7.3 over the long-term. The programs lead to reductions in taxpayer costs associated with crime, unemployment and healthcare, as well as contribute to a better-prepared workforce.",82961,gotf27,https://www.journals.uchicago.edu/doi/abs/10.1086/705718,1725,1590215775.0,,science
Cigarette butts are the most common form of litter on the planet: 4.5 trillion are littered each year. New research shows that they severely impact plant growth. The presence of cigarette butts reduced root biomass by 57%; germination success by 27%; and shoot length by 28%.,82559,cfgou9,https://www.sciencedirect.com/science/article/pii/S0147651319307481?via%3Dihub,3144,1563618655.0,,science
Students whose sex ed programs teach abstinence as the only way to protect sexual health have less favorable attitudes toward condoms and are more likely to have unprotected sex than students who learn safe sexual practices. Abstinence-only sex education programs do not stop minors from having sex.,81997,7mpvn7,https://saludmovil.com/adolescents-taking-abstinence-only-sex-ed-more-likely-to-have-unprotected-sex/,3227,1514528114.0,,science
"Store-bought tomatoes taste bland, and scientists have discovered a gene that gives tomatoes their flavor is actually missing in about 93 percent of modern, domesticated varieties. The discovery may help bring flavor back to tomatoes you can pick up in the produce section.",81858,boc0z4,http://blogs.discovermagazine.com/d-brief/2019/05/13/tasty-store-bought-tomatoes-are-making-a-comeback/,2817,1557824628.0,,science
Large U.S. study finds that marijuana laws (both recreational & medical) appear to significantly reduce prescription opioid use.,80862,ebgos3,https://doi.org/10.1016/j.jhealeco.2019.102273,2053,1576539609.0,,science
[Megathread] World's most prestigious scientific publications issue unprecedented critiques of the Trump administration,79536,jbwlhh,https://www.reddit.com/r/science/comments/jbwlhh/megathread_worlds_most_prestigious_scientific/,4655,1602825696.0,"We have received numerous submissions concerning these editorials and have determined they warrant a megathread. Please keep all discussion on the subject to this post. We will update it as more coverage develops.

**Journal Statements:**

* [Reviving the US CDC](https://linkinghub.elsevier.com/retrieve/pii/S0140673620311405), *The Lancet*
* [Trump versus Biden: a fight for the health of a nation](https://linkinghub.elsevier.com/retrieve/pii/S0140673620317864), *The Lancet*
* [Trump lied about science](https://doi.org/10.1126/science.abe7391), *Science*
* [Scientific American Endorses Joe Biden](https://www.scientificamerican.com/article/scientific-american-endorses-joe-biden1/), *Scientific American*
* [Dying in a Leadership Vacuum](https://doi.org/10.1056/NEJMe2029812), *The New England Journal of Medicine*
* [Why Nature supports Joe Biden for US president](https://doi.org/10.1038/d41586-020-02852-x), *Nature*
* [Not throwing away our shot](https://science.sciencemag.org/content/370/6514/266), *Science*

**Press Coverage:**

* [Lancet editorial blasts Trump’s 'inconsistent and incoherent' coronavirus response](https://www.washingtonpost.com/health/2020/05/15/lancet-editorial-trump-administration-coronavirus-response/), *The Washington Post*
* [America's Top Science Journal Has Had It With Trump](https://www.wired.com/story/americas-top-science-journal-has-had-it-with-trump/), *WIRED*
* [The New England Journal of Medicine avoided politics for 208 years. Now it’s urging voters to oust Trump](https://www.washingtonpost.com/nation/2020/10/08/science-journal-endorsement-trump/), *The Washington Post*
* [In a First, New England Journal of Medicine Joins Never-Trumpers](https://www.nytimes.com/2020/10/07/health/new-england-journal-trump.html), *The New York Times*
* [Three of the Most Prestigious Scientific Journals Have Condemned Trump’s Handling of COVID-19](https://slate.com/technology/2020/10/science-nejm-nature-editorials-trump-covid19-response.html), *Slate*
* [Science journal editor calls out Trump administration](https://www.nbcnews.com/science/science-news/science-journal-editor-calls-out-trump-administration-n1243552), *NBC News*

**As always, we welcome critical comments but will still enforce relevant, respectful, and on-topic discussion.**",science
"In states where recreational marijuana has been legalized, marijuana use among youth may actually be falling, suggests a new study of 1.4 million high school students. This may be because drug dealers are replaced by licensed dispensaries that require proof of age.",79499,caoe93,https://www.cnn.com/2019/07/08/health/recreational-marijuana-laws-teens-study/index.html,2277,1562637303.0,,science
"Science Ama Series: I am Stephen Hawking, theoretical physicist. Join me to talk about making the future of technology more human, reddit. AMA!",79236,3eret9,https://www.reddit.com/r/science/comments/3eret9/science_ama_series_i_am_stephen_hawking/,8661,1438026148.0,"I signed an open letter earlier this year imploring researchers to balance the benefits of AI with the risks. The letter acknowledges that AI might one day help eradicate disease and poverty, but it also puts the onus on scientists at the forefront of this technology to keep the human factor front and center of their innovations. I'm part of a campaign enabled by Nokia and hope you will join the conversation on http://www.wired.com/maketechhuman. Learn more about my foundation here: http://stephenhawkingfoundation.org/ 
 

Due to the fact that I will be answering questions at my own pace, working with the moderators of /r/Science we are opening this thread up in advance to gather your questions. 
 

My goal will be to answer as many of the questions you submit as possible over the coming weeks. I appreciate all of your understanding, and taking the time to ask me your questions.


**Moderator Note**

This AMA will be run differently due to the constraints of Professor Hawking.  The AMA will be in two parts, today we with gather questions.  Please post your questions and vote on your favorite questions, from these questions Professor Hawking will select which ones he feels he can give answers to.  

Once the answers have been written, we, the mods, will cut and paste the answers into this AMA and post a link to the AMA in /r/science so that people can re-visit the AMA and read his answers in the proper context.  The date for this is undecided, as it depends on several factors.  

Professor Hawking is a guest of /r/science and has volunteered to answer questions; please treat him with due respect. **Comment rules will be strictly enforced, and uncivil or rude behavior will result in a loss of privileges in /r/science.**

If you have scientific expertise, please verify this with our moderators by getting your account flaired with the appropriate title.  Instructions for obtaining flair are here: [reddit Science Flair Instructions](http://www.reddit.com/r/science/wiki/flair) (Flair is automatically synced with /r/EverythingScience as well.)

Update:  [Here is a link to his answers](https://www.reddit.com/r/science/comments/3nyn5i/science_ama_series_stephen_hawking_ama_answers)",science
"Supervisors with ‘bottom-line mentality’ driven by profits to the exclusion of caring about other outcomes, like employee well-being, environment or ethics, could be hurting their bottom lines by losing the respect of their employees, who counter by withholding performance, according to a new study.",78797,ciuld0,https://www.baylor.edu/mediacommunications/news.php?action=story&story=211538,3542,1564340694.0,,science
"Sleeping less than the recommended eight hours a night is associated with intrusive, repetitive thoughts like those seen in anxiety or depression, according to new research from Binghamton University, State University of New York.",78470,7opvxp,https://www.ncbi.nlm.nih.gov/pubmed/29111422,3397,1515348930.0,,science
"Cannabis use in pregnancy: Researchers discover that continued use of cannabis at 15 weeks of pregnancy was associated with significantly lower birthweight, head circumference, birth length, and gestational age at birth, as well as with more frequent severe neonatal morbidity or death.",78262,hba8bd,https://www.mja.com.au/journal/2020/212/11/deleterious-effects-cannabis-during-pregnancy-neonatal-outcomes,4619,1592495124.0,,science
"From 2007 to 2017, the number of suicides among people ages 10 to 24 increased 56 percent",78143,dj4z87,https://www.washingtonpost.com/health/teen-suicides-increasing-at-alarming-pace-outstripping-all-other-age-groups/2019/10/16/e24194c6-f04a-11e9-8693-f487e46784aa_story.html,6479,1571340167.0,,science
Pablo Escobar's hippos have become an invasive species in Colombia,77620,ex5rf3,https://www.cnet.com/news/pablo-escobars-hippos-have-become-an-invasive-species-in-colombia/,2792,1580590610.0,,science
"Breast cancer linked to permanent hair dye and chemical hair straighteners in study of almost 50,000 women",77386,e61p2u,https://www.newsweek.com/breast-cancer-linked-permanent-hair-dye-chemical-hair-straighteners-study-almost-50000-women-1475328,1901,1575505721.0,,science
"In 2009, the Obama Administration began issuing press releases naming facilities that violate OSHA safety and health regulations. This naming and shaming led other facilities to substantially improve their compliance and experience fewer work injuries. The Trump administration ended the practice.",77075,gs7wb5,https://www.aeaweb.org/articles?id=10.1257/aer.20180501,1406,1590707112.0,,science
"Scientists have found ""supercorals"" in Hawaii’s Kāne’ohe Bay, where a reef is thriving despite development, dredging, sewage and high temperatures. In the lab, the corals also withstood simulated climate change, including rising acidity and temps. The find could offer hope for the future of corals.",76926,bp4esa,http://blogs.discovermagazine.com/d-brief/2019/05/15/some-corals-in-hawaii-thrive-in-warm-acidic-water/#.XNyNnZNKhTY,1631,1557987257.0,,science
"About 40% of US adults are obese, government survey finds",76620,fabd6r,https://apnews.com/a2154b643d53afae2a3654f722a9b60a,10799,1582835273.0,,science
Researchers first to uncover how the cannabis plant creates important pain-relieving molecules that are 30 times more powerful at reducing inflammation than Aspirin. The discovery unlocks the potential to create a naturally derived pain treatment for relief of acute and chronic pain beyond opioids.,76481,cgy0b3,https://news.uoguelph.ca/2019/07/u-of-g%E2%80%AFresearchers-first-to-unlock-access-to-pain%E2%80%AFrelief%E2%80%AFpotential-of-cannabis%E2%80%AF/,1407,1563942562.0,,science
"People who are ""night owls"" and those who are ""morning larks"" have a fundamental difference in brain function. This difference is why we should rethink the 9-to-5 workday, say researchers.",76398,aqqni1,https://www.inverse.com/article/53324-night-owls-morning-larks-study,4408,1550218810.0,,science
"Instead of ‘finding your passion,’ try developing it, Stanford scholars say. The belief that interests arrive fully formed and must simply be “found” can lead people to limit their pursuit of new fields and give up when they encounter challenges, according to a new Stanford study.",75794,8si2i9,https://news.stanford.edu/2018/06/18/find-passion-may-bad-advice/,1366,1529528122.0,,science
"Men initiate sex more than three times as often as women do in a long-term, heterosexual relationship. However, sex happens far more often when the woman takes the initiative, suggesting it is the woman who sets limits, and passion plays a significant role in sex frequency, suggests a new study.",75670,bpaxoj,https://www.eurekalert.org/pub_releases/2019-05/nuos-ptl051319.php,5815,1558031879.0,,science
