title,score,id,url,comms_num,created,body,subreddit
"Just thinking about a bright light is enough to change the size of our pupils, even if there isn’t anything real for our eyes to react to, finds a new study in PNAS, thus giving a different meaning to old proverbs about the eyes being a window to the mind.",42129,dovksd,https://www.newscientist.com/article/2221634-just-thinking-about-bright-objects-changes-the-size-of-your-pupils/,805,1572409216.0,,science
"Predators could be the antidote to unhealthy herds, suggests new study. The healthy herd hypothesis suggests predators reduce disease risk for wild animal populations, by being more likely to attack the infected, and by reducing the density of prey populations and the chances the sick infect others.",42125,daez49,https://www.futurity.org/predators-animal-health-biodiversity-2171602-2/,1704,1569700100.0,,science
"When doctors and nurses can disclose and discuss errors, hospital mortality rates decline - An association between hospitals' openness and mortality rates has been demonstrated for the first time in a study among 137 acute trusts in England",42121,blxp5b,https://www.knowledge.unibocconi.eu/notizia.php?idArt=20760,518,1557299467.0,,science
"The Militarization of Police Does Not Reduce Crime - new study reveals that SWAT tends to be deployed in majority black communities. Further, militarization doesn't reduce crime or increase officer safety. Lastly, militarization was also found to reduce trust in police.",42103,98zkmj,https://psmag.com/social-justice/militarization-of-police-does-not-reduce-crime,1853,1534849632.0,,science
"Narcissists are less likely to support democracy, finds a new study, which suggests this is probably because narcissists tend to feel entitled and superior to others, which results in lower tolerance of diverse political opinions.",42102,a3gvu9,https://www.eurekalert.org/pub_releases/2018-12/uok-nll120518.php,1545,1544074609.0,,science
"Research show skies above the Southern Hemisphere have recovered since a 1987 treaty banned chemicals that eat away at the atmosphere’s protective layer. Over the last 15 years, the ozone hole has shrunk by about 20%, which scientists credited to the 1987 Montreal Protocol",42101,fouxrq,https://www.bnnbloomberg.ca/southern-skies-benefit-from-a-rare-climate-diplomacy-success-1.1412228,433,1585188176.0,,science
"Cheetahs heading towards extinction as population crashes - The sleek, speedy cheetah is rapidly heading towards extinction according to a new study into declining numbers. The report estimates that there are just 7,100 of the world's fastest mammals now left in the wild.",42094,5kfw6w,http://www.bbc.com/news/science-environment-38415906,1933,1482816600.0,,science
"Being the father of a school-aged daughter makes men less sexist, according to a new study. The findings support the idea that men become more aware of the challenges facing women when they see the female experience of life up close through their offspring – dubbed the “mighty girl” effect.",42066,a63xxc,https://www.theguardian.com/world/2018/dec/14/being-a-father-to-school-aged-daughter-makes-men-less-sexist,2707,1544814845.0,,science
"Solid state battery breakthrough could double the density of lithium-ion cells, reports a new study, opening the door to double-density solid state lithium batteries that won't explode or catch fire if they overheat, and extending the range of electric vehicles.",42063,e3lni1,https://newatlas.com/science/deakin-solid-state-battery-polymer-electrolyte/,1072,1575093345.0,,science
"Older Children, 10-19, Spread the Coronavirus Just as Much as Adults, Large Study Finds.",42038,hty2ek,https://wwwnc.cdc.gov/eid/article/26/10/20-1315_article,1196,1595181174.0,,science
New research finds that sexual intercourse has greater sedative properties for women than it does for men. Women reported a higher likelihood of falling asleep after heterosexual penile–vaginal intercourse than did men and were also more likely to report falling asleep before their partner,42025,g15tk6,https://www.psypost.org/2020/04/new-research-indicates-that-women-are-more-likely-to-fall-asleep-after-sex-than-men-56467,1879,1586900833.0,,science
"MDMA made older mice start socializing like adolescent mice, finds a new study in Nature. MDMA, the active ingredient of the drug ecstasy, might return older brains to a more malleable state, and provides a potential basis as to why MDMA has helped treat post-traumatic stress disorder.",42020,b94ns6,https://gizmodo.com/mdma-made-older-mice-start-socializing-like-teenagers-1833775862,1254,1554359253.0,,science
"Fishery collapse ‘confirms Silent Spring pesticide prophecy', suggests researchers in new Japanese study in Science, which showed an immediate plunge in insect and plankton numbers after introduction of neonicotinoid pesticides to rice paddies, rapidly followed by the collapse of fish populations.",42023,dq2s7l,https://www.theguardian.com/environment/2019/oct/31/fishery-collapse-confirms-silent-spring-pesticide-prophecy,847,1572635556.0,,science
"Eight out of 10 marijuana users in states where cannabis is legal say they partake in the drug shortly before or after exercise, and most report that it motivates them to work out, helps them enjoy exercise more and improves their recovery, according to new research (n=605).",41999,bj9inv,https://www.eurekalert.org/pub_releases/2019-04/uoca-tn042919.php,1919,1556691492.0,,science
"HPV vaccine has significantly cut rates of cancer-causing infections, including precancerous lesions and genital warts in girls and women, with boys and men benefiting even when they are not vaccinated, finds new research across 14 high-income countries, including 60 million people, over 8 years.",41985,c64wc7,https://www.newscientist.com/article/2207722-hpv-vaccine-has-significantly-cut-rates-of-cancer-causing-infections/,1264,1561667180.0,,science
"Steroids cut death rates among critically ill COVID-19 patients, major study finds",41960,iliilm,https://www.reuters.com/article/us-health-coronavirus-steroids-idUSKBN25T20D,1123,1599119457.0,,science
Scientists have confirmed that the Asian common toad’s toxic slime will likely kill nearly everything in Madagascar that tries to eat it and devastate the African island’s unique biodiversity,41945,8or4lz,http://www.sciencemag.org/news/2018/06/toxic-toads-could-devastate-madagascar-s-biodiversity,1709,1528236830.0,,science
"A new study found that 44 percent of medical cannabis users stopped taking a pharmaceutical drug, or used less of one, or both, in favor of cannabis. They rated marijuana better than pharmaceutical drugs on effectiveness, side effects, availability and cost.",41943,ah99kv,https://news.umich.edu/many-users-prefer-medical-marijuana-over-prescription-drugs/,1066,1547837199.0,,science
"Evolution row ends as scientists declare sponges to be sister of all other animals. Sponges were first to branch off the evolutionary tree from the common ancestor of all animals, finds new study in Current Biology.",41900,7gu0tv,https://www.theguardian.com/science/2017/nov/30/evolution-row-ends-as-scientists-declare-sponges-to-be-sister-of-all-animals,1126,1512150253.0,,science
"Expanding Medicaid to more low-income adults helped many of them feel healthier, and do a better job at work or a job search, in just 1 year after new health coverage. Those with mental health disorders such as depression or addiction got an especially big boost in health and work-related measures.",41902,ddmckf,https://labblog.uofmhealth.org/industry-dx/benefits-for-mind-body-and-work-ability-seen-medicaid-expansion,1341,1570305704.0,,science
"Scientists discovered traces of marijuana atop an 8th century BCE altar in a shrine within the Tel Arad fortress, thought to have been a southern stronghold in the Kingdom of Judah. The scientists believe marijuana may have been used in religious practices at the time.",41839,gsh6f4,https://www.inverse.com/science/scientists-discover-biblical-weed,1290,1590736594.0,,science
"A new study on different kinds of loneliness suggests that having poor quality relationships is associated with greater distress than having too few, based on 1,839 US adults. In other words, it’s the quality, not quantity, of your relationships that really matters.",41831,asmwdr,https://digest.bps.org.uk/2019/02/20/different-kinds-of-loneliness-having-poor-quality-relationships-is-associated-with-a-greater-toll-than-having-too-few/,1022,1550688084.0,,science
"The natural terpenes in marijuana are removed during distillation to produce pure THC in e-liquids for vaping, and then added back in for taste and smell, but they can produce toxic chemicals in the vapor users inhale, such as benzene, methacrolein, xylenes, toluene, styrene and ethylbenzene.",41808,e8phsj,https://www.upi.com/Health_News/2019/12/10/Terpenes-in-marijuana-vaping-products-may-produce-toxic-chemicals/6861575932260/,2871,1576006412.0,,science
"Expectations shape your relationship, suggests a new study (n=253), which found that people were more grateful, had more respect, and were more satisfied with their relationships if they had low expectations of sacrifice by their partners, supporting the theory that “expectations kill gratitude”.",41801,dalbah,https://www.psychologytoday.com/au/blog/between-you-and-me/201909/how-expectations-are-shaping-your-relationship,765,1569730893.0,,science
"Mercury found to be tectonically active, joining the Earth as the only other geologically active planet in the Solar System",41789,54mzmc,https://www.nasa.gov/feature/the-incredible-shrinking-mercury-is-active-after-all,686,1474953541.0,,science
"Methane-consuming bacteria could be the future of fuel, with new discovery in journal Science illuminating how they turn methane gas into liquid methanol, removing a harmful greenhouse gas while also generating a sustainable fuel at room temperature, compared to current processes at 1,300 Celsius.",41782,bnb53v,https://news.northwestern.edu/stories/2019/05/methane-consuming-bacteria-could-be-the-future-of-fuel/,830,1557603450.0,,science
"Children born to older mothers experience fewer behavioural, social and emotional difficulties, a new study has suggested.",41672,60uz6f,http://www.independent.co.uk/life-style/health-and-families/health-news/older-mothers-better-less-difficulties-behavioural-social-emotional-aarhus-university-denmark-a7642826.html,1835,1490222212.0,,science
"A healthy mix of social nourishment (meaningful social interactions) and restorative solitude (contented alone time) is linked to human thriving, suggests a new study (n=389), which found that the more choice people have about the social mix, which forms their “social biome”, the better they do.",41664,efldql,https://www.psychologytoday.com/au/blog/the-athletes-way/201912/social-nourishment-restorative-solitude-human-thriving,464,1577334618.0,,science
"It’s not just bees that are being harmed by the pesticides called neonicotinoids, it’s birds too. A study in Canada has shown that migrating white-crowned sparrows lose weight just hours after eating seeds treated with the neocotinoid imidacloprid, delaying their onward migration by several days.",41643,d3nue8,https://www.newscientist.com/article/2216318-decline-of-migrating-birds-could-be-partly-due-to-pesticides/,463,1568402901.0,,science
"Teens who face rejection by their fathers tend to experience more social anxiety—and more loneliness—later on, research shows.",41640,7l4jgw,http://news.psu.edu/story/497338/2017/12/13/research/father%E2%80%99s-rejection-may-increase-child%E2%80%99s-social-anxiety-loneliness,2483,1513833837.0,,science
"A study has found men view traditional symptoms of depression as more severe than other types of symptoms, and men with traditional depressive symptoms are perceived as more feminine and less masculine. This has major implications for stigma and help-seeking",41619,g7t0j9,https://today.ku.edu/2020/04/08/studies-show-men-view-traditional-depression-more-severe-those-suffering-less-masculine,940,1587847866.0,,science
Party over platform: Trump's varied statements on a range of issues gave political scientists a unique opportunity to see that Trump supporters are more attached to the party label than conservative principles.,41601,a7gfjt,https://news.byu.edu/news/does-political-party-trump-ideology,2052,1545203489.0,,science
"Globally, gay men are disliked more than lesbian women across 23 countries. The endorsement of traditional gender roles was associated with anti-gay attitudes in every Western country studied, but in China and India, this was reversed. Those endorsing gender norms were most positive towards gays.",41570,eftqv1,http://www.spsp.org/news-center/press-releases/bettinsoli-global-attitudes,2874,1577383447.0,,science
"The US may have entered a “post-truth” era, but Australia may not have. Past research on people in the US about their views on politicians who frequently bend the truth found that fact-checking had little impact, whereas a new study found that for Australians it did change their political opinions.",41543,ach844,https://www.newscientist.com/article/2189545-australians-care-if-politicians-tell-lies-but-people-in-the-us-dont/,2206,1546629372.0,,science
"When pollen is hard to come by, bees nibble on the leaves of plants, stimulating faster flower growth. Some plants bloom up to a month earlier, reports a study in ""Science."" This survival strategy could help bees overcome habitat loss.",41528,go40d1,https://www.inverse.com/science/bumblebees-are-hacking-nature-to-survive,407,1590119903.0,,science
"People living in colder regions with less sunlight drink more alcohol than their warm-weather counterparts. The new study found that as temperature and sunlight hours dropped, alcohol consumption increased.",41507,a93xse,https://www.upmc.com/media/news/111418-alcohol-and-weather?T=AU,1985,1545676282.0,,science
"“Instagram vs. Reality” posts exposing the fake side of Instagram might help body image, suggests a new US study (n=305), which found that unrealistic images with photo editing tools increase women’s body dissatisfaction, but posts exposing these images as fake can improve women’s body image.",41481,e7rloy,https://www.psychologytoday.com/au/blog/beauty-sick/201912/do-instagram-vs-reality-posts-make-difference,1485,1575824420.0,,science
"The first study of its kind has found that people who vape have the same mix of gut bacteria as non-smokers, whilst smokers have significant changes to their microbiome.",41466,8g19fj,https://www.eurekalert.org/pub_releases/2018-04/nu-van042718.php,1422,1525138492.0,,science
"For the First Time, Researchers Eliminated HIV From the Genomes of Living Animals",41456,c8auwm,https://time.com/5618644/hiv-gene-editing-cure/,454,1562111446.0,,science
"‘Geek Girl’ gamers are more likely to study science and technology degrees - Girls who play video games are three times more likely to choose physical science, technology, engineering or maths (PSTEM) degrees compared to their non-gaming counterparts, according to new research.",41411,9pdgjc,https://www.surrey.ac.uk/news/geek-girl-gamers-are-more-likely-study-science-and-technology-degrees,2026,1539926893.0,,science
New research suggests that even non-verbal displays of synchrony (when movements between people become coordinated and synchronized) during ordinary activities in everyday lives can deepen the experience of closeness and sexual desire between partners.,41418,9w3e5u,https://www.psypost.org/2018/11/behavioral-synchrony-between-partners-linked-to-heightened-intimacy-and-sexual-desire-52553,949,1541967859.0,,science
"Marijuana legalization reduces opioid deaths, according to a new study, which found that legalization and access to recreational marijuana reduced annual opioid mortality in the range of 20% to 35%, with particularly pronounced effects for synthetic opioids.",41380,cn45du,https://newsroom.wiley.com/press-release/economic-inquiry/marijuana-legalization-reduces-opioid-deaths,1066,1565203137.0,,science
"Keep exercising as it’s good for your brain’s gray matter, suggests new study (n=2,013). Cardiorespiratory fitness is linked to increases in gray matter and total brain volume, associated with cognition, suggesting that exercise contributes to improved brain health and slows decline in gray matter.",41359,eje5gq,https://newsnetwork.mayoclinic.org/discussion/keep-exercising-new-study-finds-its-good-for-your-brains-gray-matter/,705,1578079398.0,,science
"Researchers have found that individuals who took even a single dose of psychedelic drugs like LSD, ""magic"" mushrooms and ayahuasca could experience sustained personality changes that lasted several weeks, months or even years",41353,81qpk9,https://www.ncbi.nlm.nih.gov/pubmed/29452127,3132,1520119125.0,,science
"A Keto diet with no exercise out-performs the standard American diet with exercise in reducing body weight, BMI, body fat and HgA1c in patients with Metabolic Syndrome.",41346,7hs6ro,http://www.sciencedirect.com/science/article/pii/S1871402116303137?via%3Dihub,4664,1512531628.0,,science
"Half of neanderthals had surfer's ear in a new study of 23 skulls found in Europe and southwest Asia. The condition is caused by regular exposure to cold water, and scientists say it's evidence that our ancient human cousins spent a lot of time in aquatic environments, perhaps gathering food.",41342,cqxkum,http://blogs.discovermagazine.com/d-brief/2019/08/14/neanderthal-surfers-ear-exostoses/#.XVXjfJNKhTY,820,1565939002.0,,science
"A national Australian study has found more than half of car drivers think cyclists are not completely human. The study (n=442) found a link between dehumanization and deliberate acts of aggression, with more than one in ten people having deliberately driven their car close to a cyclist.",41307,b631mc,https://www.qut.edu.au/news?id=141968,5387,1553713132.0,,science
"Blockbuster films ignore the real harbinger of the apocalypse: ignorance of science - A new UCLA study that analyzed disaster films between 1956 and 2016, published in the journal Futures, finds that the public would rather blame global disaster on human greed or ego than on simple ignorance.",41286,7smgsu,https://www.theverge.com/tldr/2018/1/23/16924510/apocalypse-blockbuster-movies-tech-greed-villains-science-climate-change,1447,1516822161.0,,science
"When temperatures in Southwestern U.S. climb to over 100 degrees, the pavement can get hot enough to cause second-degree burns on human skin within 2 seconds, finds a new study. The pavement on a 111-degree day, for example, can get as hot as 147 degrees in direct sunlight.",41282,cifuxi,https://www.unlv.edu/news/release/study-sizzling-southwest-summers-can-cause-pavement-burns-seconds,2130,1564251291.0,,science
"Testosterone increased leading up to skydiving and was related to greater cortisol reactivity and higher heart rate, finds a new study. “Testosterone has gotten a bad reputation, but it isn’t about aggression or being a jerk. Testosterone helps to motivate us to achieve goals and rewards.”",41275,basuvr,https://www.psypost.org/2019/04/new-study-reveals-how-skydiving-impacts-your-testosterone-and-cortisol-levels-53446,1346,1554753227.0,,science
"The percentage of young U.S. children who don’t receive any vaccines has quadrupled since 2001, according to a new report from the Centers of Disease Control and Prevention.",41271,9nm7ef,https://www.washingtonpost.com/national/health-science/percentage-of-young-us-children-who-dont-receive-any-vaccines-has-quadrupled-since-2001/2018/10/11/4a9cca98-cd0d-11e8-920f-dd52e1ae4570_story.html?noredirect=on&utm_term=.03d25f27d202&wpisrc=nl_sb_smartbrief,2637,1539393644.0,,science
"Results from 27 countries suggest that, despite the risk of severe illness due to COVID-19, elderly people are not more willing to isolate when asked to, and aren't compliant with COVID-19 preventive measures. People aged 60 to 80 are also less likely than younger age groups to wear a mask outside",41203,hpr1vw,https://www.eurekalert.org/pub_releases/2020-07/p-epr070220.php,2005,1594571293.0,,science
"Researchers Think a ""K-Hole"" Might Actually Be the Brain Going Offline--Much like a ""Near Death Experience"": The brain waves of sheep that were given a more intense dose of Ketamine appeared to stop altogether for a period of several minutes.",41200,hecmsp,https://www.nature.com/articles/s41598-020-66023-8,2107,1592939222.0,,science
"The death of a close friend can have an impact on health and wellbeing for up to four years, according to a new study of 26,515 people over 14 years, which found a range of negative consequences experienced by those who had a close friend die.",41159,bo2nez,https://www.bbc.com/news/uk-scotland-48238600,1140,1557778131.0,,science
"Optimism is lowest in people's twenties, rises steadily into people's thirties and forties, peaks in people's fifties, and gradually declines after that, suggests new research (n=1,169) that charts the trajectory of optimism over the lifespan, which found people experienced peak optimism at age 55.",41122,bia4fu,https://www.psychologytoday.com/au/blog/social-instincts/201904/what-age-is-our-sense-optimism-its-highest,1161,1556478187.0,,science
A new study has revealed that it's general exchanges of words and signs of affection following sex that directly cause increased long-term happiness and more life satisfaction in couples who have sex at least once a week.,41120,5wvsod,http://www.medicaldaily.com/surprising-reason-more-sex-may-be-key-happiness-cuddling-and-affection-412434,1168,1488404086.0,,science
"Despite overwhelming scientific evidence that vaccines are safe and effective in preventing childhood diseases, a significant minority remains skeptical, such as the anti-vax movement. Mathematicians show this may be due to ""hysteresis"", where an effect persists despite changed initial conditions.",41084,aejazl,https://www.newsweek.com/hysteresis-phenomenon-behind-anti-vax-movement-1283716,1983,1547157110.0,,science
"People working in low paying, unstable jobs show more signs of chronic stress than people who are unemployed.",41059,6u2lr3,https://www.researchgate.net/blog/post/having-a-bad-job-may-be-worse-for-your-health-than-having-no-job-at-all,3189,1502924505.0,,science
"Organically farmed food has a bigger climate impact than conventionally farmed food, due to the greater areas of land required.",41045,a5ykty,https://www.mynewsdesk.com/uk/chalmers/pressreleases/organic-food-worse-for-the-climate-2813280,2636,1544769611.0,,science
False modesty isn’t fooling anyone: humblebragging makes people dislike you according to a new study from researchers at Harvard and the University of North Carolina Chapel Hill.,41041,7pg49f,http://time.com/5095144/humblebrag-bragging/,2062,1515625451.0,,science
"The 2008 Great Recession led to an increase in obesity, diabetes and mental health issues",41028,81zqjg,"https://www.city.ac.uk/news/2018/march/2008-great-recession-led-to-increase-in-obesity,-diabetes-and-mental-health-issues,-says-study",1592,1520219192.0,,science
"Exercise has the same effect on the brain as coffee Just 20 minutes of exercise is as good as a coffee for our working memory, according to a new, first-of-its-kind study.",41017,f41jj5,https://www.nature.com/articles/s41598-019-56251-y,889,1581755119.0,,science
"You can train your brain to form good habits – like going to the gym and eating healthily – simply by repeating actions until they stick, regardless of how much satisfaction you get from it, according to new research using computer simulations of digital rodents.",41004,akzk6x,https://warwick.ac.uk/newsandevents/pressreleases/train_the_brain,1401,1548793959.0,,science
"Herpes vaccine to be tested in humans after best result yet in animals, finds a new study on herpes simplex 2 virus (HSV2). An experimental vaccine prevented genital lesions in all mice and guinea pigs tested. In 98% of mice and 80% of guinea pigs it also prevented the low-level “hidden” infections.",40944,d7hiqo,https://www.newscientist.com/article/2217255-herpes-vaccine-to-be-tested-in-humans-after-best-result-yet-in-animals/,1308,1569133957.0,,science
"New studies suggest people with blood type O may have a lower risk of COVID-19 infection and reduced likelihood of severe outcomes, including organ complications, if they do get sick. Meanwhile, individuals with type A and AB may have increased risk of severe clinical outcomes.",40930,jbc9ws,https://www.hematology.org/newsroom/press-releases/2020/possible-link-between-blood-type-and-covid-19,1554,1602747356.0,,science
"Moths have 'secret role' as crucial pollinators: Long seen as annoying creatures that can leave holes in your clothes, moths have been badly misjudged, say scientists. New research suggests they play a vital role as overnight pollinators of a wide range of flowers and plants.",40929,givyle,https://royalsocietypublishing.org/doi/10.1098/rsbl.2019.0877,810,1589392115.0,,science
"Fewer children visited emergency rooms for asthma problems in the three years after cities banned indoor smoking than in the three years before, according to a new study by Brown University School of Public Health.",40924,5l38dp,https://news.brown.edu/articles/2016/12/smoking,1712,1483130206.0,,science
"The same researcher who 20 years ago made the discovery that linked abnormalities in egg chromosomes in mice to BPA, has just published a new study that found reproductive defects in mice housed in plastic cages made with BPA alternatives, suggesting that BPA-free products may not be safe.",40864,9g0n3g,https://news.wsu.edu/2018/09/13/wsu-researchers-see-new-plastics-causing-reproductive-woes-old-plastics/,1624,1537037970.0,,science
